{
  "schema_version": "1",
  "bindings": {
    "content_sha256": "28c1410fe0feb2fb9b47fb47ea728556b95582ecca06da32b5bb6a324ca4bf72",
    "registry_sha256": "80daf05124dcd204d161cf8415c519ae0c67b34e3ba8b5ac7f2a5ff777b8f654",
    "structure_sha256": "4e9f828bc3cb86c8bc7031e4d6908b6759bbe0ef0e799d1e5de174bfc21a50d2"
  },
  "segments": [
    {
      "id": "paragraph:0:449",
      "type": "paragraph",
      "start_byte": 0,
      "end_byte": 449
    },
    {
      "id": "paragraph:450:974",
      "type": "paragraph",
      "start_byte": 450,
      "end_byte": 974
    },
    {
      "id": "paragraph:975:1600",
      "type": "paragraph",
      "start_byte": 975,
      "end_byte": 1600
    },
    {
      "id": "paragraph:1601:2093",
      "type": "paragraph",
      "start_byte": 1601,
      "end_byte": 2093
    },
    {
      "id": "paragraph:2094:2515",
      "type": "paragraph",
      "start_byte": 2094,
      "end_byte": 2515
    },
    {
      "id": "paragraph:2516:2902",
      "type": "paragraph",
      "start_byte": 2516,
      "end_byte": 2902
    },
    {
      "id": "paragraph:2903:3177",
      "type": "paragraph",
      "start_byte": 2903,
      "end_byte": 3177
    }
  ],
  "programmatic_checks": [
    {
      "id": "no-em-dashes",
      "status": "clear",
      "severity": "strong_warning",
      "category": "Style",
      "failure_modes": [
        "genre_misfit"
      ],
      "evidence": {
        "quoted_phrases": [],
        "metric": null,
        "locations": [],
        "counts": {},
        "raw": {
          "matches": [],
          "evidence": "No em dashes found",
          "candidates": [],
          "candidate_count": 0,
          "aggregate_finding": false,
          "threshold_met": false,
          "threshold": null,
          "context_suppressed": false,
          "context_reason": null,
          "evidence_type": "lexical",
          "spans": [],
          "match_count": 0,
          "context_gate": {
            "applied": false,
            "raw_evidence": "No em dashes found",
            "suppression_reason": null,
            "effective_threshold": null
          },
          "severity": "strong_warning",
          "failure_modes": [
            "genre_misfit"
          ],
          "evidence_role": "punctuation_signal",
          "guidance": "Treat as a strong 2026 AI-style signal. May be preserved only at Balanced depth with explicit disclosure; All requires removal."
        }
      }
    },
    {
      "id": "no-ai-vocabulary-clustering",
      "status": "clear",
      "severity": "strong_warning",
      "category": "Language and grammar",
      "failure_modes": [
        "generic_abstraction"
      ],
      "evidence": {
        "quoted_phrases": [],
        "metric": null,
        "locations": [],
        "counts": {},
        "raw": {
          "evidence": "Max AI words per paragraph: 2 (2 total in text)",
          "candidates": [],
          "candidate_count": 0,
          "aggregate_finding": false,
          "threshold_met": false,
          "threshold": null,
          "context_suppressed": false,
          "context_reason": null,
          "evidence_type": "lexical",
          "spans": [],
          "match_count": 0,
          "context_gate": {
            "applied": false,
            "raw_evidence": "Max AI words per paragraph: 2 (2 total in text)",
            "suppression_reason": null,
            "effective_threshold": null
          },
          "severity": "strong_warning",
          "failure_modes": [
            "generic_abstraction"
          ],
          "evidence_role": "vocabulary_cluster",
          "guidance": "Fix clustered generic AI vocabulary; individual words may be fine in context."
        }
      }
    },
    {
      "id": "no-nonliteral-land-surface",
      "status": "clear",
      "severity": "strong_warning",
      "category": "Voice and register",
      "failure_modes": [
        "generic_abstraction",
        "synthetic_significance"
      ],
      "evidence": {
        "quoted_phrases": [],
        "metric": null,
        "locations": [],
        "counts": {},
        "raw": {
          "matches": [],
          "evidence": "No nonliteral land/surface constructions found",
          "candidates": [],
          "candidate_count": 0,
          "aggregate_finding": false,
          "threshold_met": false,
          "threshold": null,
          "context_suppressed": false,
          "context_reason": null,
          "evidence_type": "lexical",
          "spans": [],
          "match_count": 0,
          "context_gate": {
            "applied": false,
            "raw_evidence": "No nonliteral land/surface constructions found",
            "suppression_reason": null,
            "effective_threshold": null
          },
          "severity": "strong_warning",
          "failure_modes": [
            "generic_abstraction",
            "synthetic_significance"
          ],
          "evidence_role": "metaphor_residue",
          "guidance": "Fix nonliteral land/surface phrasing; replace with the concrete action or claim."
        }
      }
    },
    {
      "id": "overall-signal-stacking",
      "status": "clear",
      "severity": "context_warning",
      "category": "Signal stacking",
      "failure_modes": [
        "generic_abstraction",
        "frictionless_structure"
      ],
      "evidence": {
        "quoted_phrases": [],
        "metric": null,
        "locations": [],
        "counts": {
          "score": 3,
          "threshold": 4
        },
        "raw": {
          "score": 3,
          "threshold": 4,
          "components": [
            "soft scaffolding"
          ],
          "vocabulary_signal_stacking": {
            "points": 2,
            "reasons": [
              "generic_cluster=2",
              "kobak_style=12 distinct/42.5"
            ],
            "worst_generic": 2,
            "gptzero_matches": [],
            "kobak_style_distinct": 12,
            "kobak_style_density": 42.45283018867924,
            "kobak_style_sample": [
              "research",
              "conditions",
              "addressing",
              "findings",
              "innovative",
              "need",
              "promising",
              "refining",
              "remains",
              "role"
            ]
          },
          "evidence": "Overall signal stacking 3/4 from [soft scaffolding]; vocab=2 point(s), worst_generic=2, gptzero=[], kobak=12 distinct/42.5/1000",
          "candidates": [],
          "candidate_count": 0,
          "aggregate_finding": false,
          "threshold_met": false,
          "context_suppressed": false,
          "context_reason": null,
          "evidence_type": "aggregate",
          "component_signals": [
            "soft scaffolding"
          ],
          "component_count": 1,
          "context_gate": {
            "applied": false,
            "raw_evidence": "Overall signal stacking 3/4 from [soft scaffolding]; vocab=2 point(s), worst_generic=2, gptzero=[], kobak=12 distinct/42.5/1000",
            "suppression_reason": null,
            "effective_threshold": 4
          },
          "severity": "context_warning",
          "failure_modes": [
            "generic_abstraction",
            "frictionless_structure"
          ],
          "evidence_role": "signal_stacking",
          "guidance": "Review aggregate signal stacking; this combines weak signals and Kobak excess-vocabulary evidence but is not an authorship verdict."
        }
      }
    },
    {
      "id": "no-manufactured-insight",
      "status": "clear",
      "severity": "strong_warning",
      "category": "Structural tells",
      "failure_modes": [
        "synthetic_significance"
      ],
      "evidence": {
        "quoted_phrases": [],
        "metric": null,
        "locations": [],
        "counts": {},
        "raw": {
          "matches": [],
          "evidence": "No manufactured insight phrases",
          "candidates": [],
          "candidate_count": 0,
          "aggregate_finding": false,
          "threshold_met": false,
          "threshold": null,
          "context_suppressed": false,
          "context_reason": null,
          "evidence_type": "lexical",
          "spans": [],
          "match_count": 0,
          "context_gate": {
            "applied": false,
            "raw_evidence": "No manufactured insight phrases",
            "suppression_reason": null,
            "effective_threshold": null
          },
          "severity": "strong_warning",
          "failure_modes": [
            "synthetic_significance"
          ],
          "evidence_role": "rhetorical_pattern",
          "guidance": "Fix at Balanced and All; at Balanced, recommend preserving only if it clearly belongs to the writer's voice."
        }
      }
    },
    {
      "id": "no-performed-candour",
      "status": "clear",
      "severity": "strong_warning",
      "category": "Voice and register",
      "failure_modes": [
        "voice_erasure",
        "generic_abstraction"
      ],
      "evidence": {
        "quoted_phrases": [],
        "metric": null,
        "locations": [],
        "counts": {},
        "raw": {
          "matches": [],
          "evidence": "No performed-candour frames",
          "candidates": [],
          "candidate_count": 0,
          "aggregate_finding": false,
          "threshold_met": false,
          "threshold": null,
          "context_suppressed": false,
          "context_reason": null,
          "evidence_type": "lexical",
          "spans": [],
          "match_count": 0,
          "context_gate": {
            "applied": false,
            "raw_evidence": "No performed-candour frames",
            "suppression_reason": null,
            "effective_threshold": null
          },
          "severity": "strong_warning",
          "failure_modes": [
            "voice_erasure",
            "generic_abstraction"
          ],
          "evidence_role": "candour_frame",